{
  "id": "test-simple",
  "translations": {
    "en": {
      "label": "Test Simple",
      "description": "Simple test calendar for basic testing",
      "setting": "Test"
    }
  },
  "year": {
    "epoch": 0,
    "currentYear": 1,
    "prefix": "",
    "suffix": "",
    "startDay": 0
  },
  "leapYear": {
    "rule": "none"
  },
  "months": [
    { "name": "Month1", "days": 30 },
    { "name": "Month2", "days": 30 }
  ],
  "weekdays": [{ "name": "Day1" }, { "name": "Day2" }, { "name": "Day3" }],
  "intercalary": [],
  "time": {
    "hoursInDay": 24,
    "minutesInHour": 60,
    "secondsInMinute": 60
  }
}
