{
  "id": "test-gregorian",
  "translations": {
    "en": {
      "label": "Test Gregorian",
      "description": "Test calendar for Gregorian-style testing",
      "setting": "Test"
    }
  },
  "year": {
    "epoch": 2024,
    "currentYear": 2024,
    "prefix": "",
    "suffix": " CE",
    "startDay": 1
  },
  "leapYear": {
    "rule": "gregorian",
    "month": "February",
    "extraDays": 1
  },
  "months": [
    { "name": "January", "days": 31 },
    { "name": "February", "days": 28 },
    { "name": "March", "days": 31 },
    { "name": "April", "days": 30 },
    { "name": "May", "days": 31 },
    { "name": "June", "days": 30 },
    { "name": "July", "days": 31 },
    { "name": "August", "days": 31 },
    { "name": "September", "days": 30 },
    { "name": "October", "days": 31 },
    { "name": "November", "days": 30 },
    { "name": "December", "days": 31 }
  ],
  "weekdays": [
    { "name": "Sunday" },
    { "name": "Monday" },
    { "name": "Tuesday" },
    { "name": "Wednesday" },
    { "name": "Thursday" },
    { "name": "Friday" },
    { "name": "Saturday" }
  ],
  "intercalary": [],
  "time": {
    "hoursInDay": 24,
    "minutesInHour": 60,
    "secondsInMinute": 60
  }
}
