{
  "id": "forbidden-lands",
  "translations": {
    "en": {
      "label": "Forbidden Lands Calendar",
      "description": "The calendar system used in the Forbidden Lands, featuring eight months that follow the eternal cycle of seasons rising and waning in this post-apocalyptic fantasy world.",
      "setting": "Forbidden Lands RPG"
    }
  },

  "year": {
    "epoch": 0,
    "currentYear": 1165,
    "prefix": "",
    "suffix": " AS",
    "startDay": 0
  },

  "leapYear": {
    "rule": "none"
  },

  "months": [
    {
      "name": "Winterwane",
      "abbreviation": "Win",
      "days": 46,
      "description": "The final dying of winter's grip as the longest month slowly gives way to the first stirrings of spring in the ravaged lands."
    },
    {
      "name": "Springrise",
      "abbreviation": "Spr",
      "days": 45,
      "description": "Spring awakens and begins to reclaim the Forbidden Lands, bringing new growth and hope to the survivors of the Blood Mist."
    },
    {
      "name": "Springwane",
      "abbreviation": "Spr",
      "days": 46,
      "description": "Spring reaches its peak and begins to fade as the wheel of seasons turns toward the heat and abundance of summer."
    },
    {
      "name": "Sumerrise",
      "abbreviation": "Sum",
      "days": 45,
      "description": "Summer rises to dominance, bringing warmth and life to lands that have known too much death and desolation."
    },
    {
      "name": "Summerwane",
      "abbreviation": "Sum",
      "days": 46,
      "description": "Summer's power begins to ebb as the cycle continues its eternal turn toward the harvest time and autumn's approach."
    },
    {
      "name": "Fallrise",
      "abbreviation": "Fal",
      "days": 45,
      "description": "Autumn arrives to paint the Forbidden Lands in colors of change, bringing both beauty and the warning of winter's return."
    },
    {
      "name": "Fallwane",
      "abbreviation": "Fal",
      "days": 46,
      "description": "Autumn's grip strengthens as the world prepares for winter's harsh rule over the dangerous and desolate Forbidden Lands."
    },
    {
      "name": "Winterrise",
      "abbreviation": "Win",
      "days": 45,
      "description": "Winter returns to claim the land once more, bringing cold, darkness, and the heightened dangers that stalk the frozen wastes."
    }
  ],

  "weekdays": [
    {
      "name": "Sunday",
      "abbreviation": "Su",
      "description": "The sun's day, offering light and hope in a world where both are precious and often fleeting"
    },
    {
      "name": "Moonday",
      "abbreviation": "Mo",
      "description": "The moon's day, when the pale light reveals both beauty and hidden threats in the Forbidden Lands"
    },
    {
      "name": "Bloodday",
      "abbreviation": "Bl",
      "description": "A day marked by violence and struggle, reflecting the harsh realities of survival in these dangerous lands"
    },
    {
      "name": "Earthday",
      "abbreviation": "Ea",
      "description": "A day to remember the solid ground beneath one's feet and the importance of claiming territory in the wasteland"
    },
    {
      "name": "Growthday",
      "abbreviation": "Gr",
      "description": "A day celebrating new life and expansion, as communities slowly reclaim the lands from the wilderness"
    },
    {
      "name": "Feastday",
      "abbreviation": "Fe",
      "description": "A day for sharing food and fellowship, reminding survivors that cooperation is essential for survival"
    },
    {
      "name": "Stillday",
      "abbreviation": "St",
      "description": "A day of rest and reflection, offering respite from the constant dangers that threaten the Forbidden Lands"
    }
  ],

  "intercalary": [],

  "seasons": [
    {
      "name": "Winter",
      "startMonth": 1,
      "endMonth": 1,
      "icon": "winter",
      "description": "The harsh season when winter's dying grip slowly loosens on the ravaged Forbidden Lands."
    },
    {
      "name": "Spring",
      "startMonth": 2,
      "endMonth": 3,
      "icon": "spring",
      "description": "The season of renewal when life cautiously returns to lands scarred by ancient catastrophe."
    },
    {
      "name": "Summer",
      "startMonth": 4,
      "endMonth": 5,
      "icon": "summer",
      "description": "The bright season bringing warmth and growth to territories still marked by desolation."
    },
    {
      "name": "Autumn",
      "startMonth": 6,
      "endMonth": 7,
      "icon": "fall",
      "description": "The season of change when the lands prepare once more for winter's harsh return."
    },
    {
      "name": "Winter",
      "startMonth": 8,
      "endMonth": 8,
      "icon": "winter",
      "description": "The beginning of winter's reign, bringing cold and heightened dangers to the frozen wastes."
    }
  ],

  "time": {
    "hoursInDay": 24,
    "minutesInHour": 60,
    "secondsInMinute": 60
  }
}
